id,card_type,card_copy,card_status,thread_count,message_count
1,Regular,"Someone spills hot oil on you, you scream...",Not Drawn,1,2
2,Regular,"You arrive at the emergency room, they ask why you're here. You calmly say…",Not Drawn,11,6
3,Regular,"You meet your tinder match, they look at you and say…",Not Drawn,8,12
4,Regular,"You're waiting to hear about your newly born baby, the doctor comes out and says…",Not Drawn,4,1
5,Regular,"You ask siri where the nearest coffee shop is, she replies…",Not Drawn,3,4
6,Regular,"You ask your crush to be exclusive, they reply…",Not Drawn,7,9